{"$id":"https://developer.microsoft.com/json-schemas/fabric/item/report/definition/page/2.1.0/schema.json","$schema":"http://json-schema.org/draft-07/schema#","title":"Page","description":"Defines a single report page.","type":"object","properties":{"$schema":{"description":"Defines the schema to use for an item.","type":"string","const":"https://developer.microsoft.com/json-schemas/fabric/item/report/definition/page/2.1.0/schema.json"},"name":{"description":"A unique identifier for the page across the whole report.","maxLength":50,"type":"string"},"displayName":{"description":"A user facing name for this page.","type":"string"},"displayOption":{"$ref":"#/definitions/PageDisplayOption","description":"Defines how the page is scaled."},"height":{"description":"Height of the page (in pixels) - optional only for 'DeprecatedDynamic' option, required otherwise.","type":"number"},"width":{"description":"Width of the page (in pixels) - optional only for 'DeprecatedDynamic' option, required otherwise.","type":"number"},"filterConfig":{"description":"Filters that apply to all the visuals on this page - on top of the filters defined for the whole report.","$ref":"../../filterConfiguration/1.3.0/schema-embedded.json"},"pageBinding":{"description":"Additional metadata defined for how this page is used (tooltip, drillthrough, etc).","$ref":"#/definitions/PageBinding"},"objects":{"description":"Defines the formatting for different objects on a page.","$ref":"#/definitions/PageFormattingObjects"},"type":{"description":"Specific usage of this page (for example drillthrough).","type":"string","anyOf":[{"const":"Drillthrough","description":"Page to be used as drillthrough."},{"const":"Tooltip","description":"Page to be used as tooltip."}]},"visibility":{"description":"Defines when this page should be visible - by default it is always visible.","type":"string","anyOf":[{"const":"AlwaysVisible","description":"Page is always shown in the pages list"},{"const":"HiddenInViewMode","description":"Page is not visible when viewing report in View mode."}]},"visualInteractions":{"description":"Defines how data point selection on a specific visual flow (as filters) to other visuals on the page.\nBy default it is up-to the visual to apply it either as a cross-highlight or as a filter.","type":"array","items":{"$ref":"#/definitions/VisualInteraction"}},"autoPageGenerationConfig":{"description":"Configuration that was used to automatically generate a page (for example using 'Auto create the report' option).","$ref":"#/definitions/AutoPageGenerationConfig"},"annotations":{"description":"Additional information to be saved (for example comments, readme, etc) for this page.","type":"array","items":{"$ref":"#/definitions/Annotation"}},"howCreated":{"description":"Source of creation of this page.","type":"string","anyOf":[{"const":"Default","description":"Page is generated by user interaction."},{"const":"Copilot","description":"Page is created by copilot."}]}},"additionalProperties":false,"required":["$schema","displayName","displayOption","name"],"definitions":{"PageDisplayOption":{"type":"string","anyOf":[{"const":"DeprecatedDynamic","description":"No dynamic page without width or height.\nDeprecated: Use other display options."},{"const":"FitToPage","description":"Page is scaled so both width and height fit on the current viewport."},{"const":"FitToWidth","description":"Only width is scaled to fit on the current viewport, height will be updated to maintain page aspect ratio."},{"const":"ActualSize","description":"No scaling is done - page is centered relative to the report canvas."},{"const":"ActualSizeTopLeft","description":"No scaling is done - page is anchored to top-left corder relative to the report canvas.\nDeprecated: Use ActualSize instead."}]},"PageBinding":{"type":"object","properties":{"name":{"description":"Name of this binding - unique across the report.","type":"string"},"type":{"$ref":"#/definitions/BindingType","description":"Specific usage of this binding (for example drillthrough)."},"referenceScope":{"description":"What is the scope under which the binding applies.","default":"Default","type":"string","anyOf":[{"const":"Default","description":"Scope is restricted to the report."},{"const":"CrossReport","description":"Scope is across reports - for cross-report drillthrough."}]},"parameters":{"description":"Additional parameters to apply when the binding is invoked.","type":"array","items":{"$ref":"#/definitions/BindingParameter"}},"acceptsFilterContext":{"description":"Should additional filter context flow when applying the binding.","default":"Default","type":"string","anyOf":[{"const":"Default","description":"Flows filter context"},{"const":"None","description":"Additional filter context does not flow to the binding."}]}},"additionalProperties":false,"required":["name","type"]},"BindingType":{"type":"string","anyOf":[{"const":"Default","description":"No specific usage of this binding."},{"const":"Drillthrough","description":"Binding to be used as drillthrough."},{"const":"Tooltip","description":"Binding to be used as tooltip page."}]},"BindingParameter":{"type":"object","properties":{"name":{"description":"Name of the parameter - unique across the report.","type":"string"},"boundFilter":{"description":"Name of the filter which this parameter affects.","type":"string"},"asAggregation":{"description":"The parameter should be applied when the field of the filter is aggregated.","type":"boolean"},"qnaSingleSelectRequired":{"description":"Exactly one instance value should be picked as a filter for this parameter.","type":"boolean"},"fieldExpr":{"description":"Field expression for page binding","$ref":"../../semanticQuery/1.4.0/schema.json#/definitions/QueryExpressionContainer"}},"additionalProperties":false,"required":["name"]},"PageFormattingObjects":{"type":"object","properties":{"pageInformation":{"type":"array","items":{"type":"object","properties":{"selector":{"description":"Defines the scope at which to apply the formatting for this object.\nCan also define rules for matching highlighted values and how multiple definitions for the same property should be ordered.","$ref":"../../formattingObjectDefinitions/1.5.0/schema.json#/definitions/Selector"},"properties":{"$ref":"#/definitions/PageInformation","description":"Describes the properties of the object to apply formatting changes to."}},"additionalProperties":false,"required":["properties"]}},"pageSize":{"type":"array","items":{"type":"object","properties":{"selector":{"description":"Defines the scope at which to apply the formatting for this object.\nCan also define rules for matching highlighted values and how multiple definitions for the same property should be ordered.","$ref":"../../formattingObjectDefinitions/1.5.0/schema.json#/definitions/Selector"},"properties":{"$ref":"#/definitions/PageSize","description":"Describes the properties of the object to apply formatting changes to."}},"additionalProperties":false,"required":["properties"]}},"background":{"type":"array","items":{"type":"object","properties":{"selector":{"description":"Defines the scope at which to apply the formatting for this object.\nCan also define rules for matching highlighted values and how multiple definitions for the same property should be ordered.","$ref":"../../formattingObjectDefinitions/1.5.0/schema.json#/definitions/Selector"},"properties":{"$ref":"#/definitions/Background","description":"Describes the properties of the object to apply formatting changes to."}},"additionalProperties":false,"required":["properties"]}},"displayArea":{"type":"array","items":{"type":"object","properties":{"selector":{"description":"Defines the scope at which to apply the formatting for this object.\nCan also define rules for matching highlighted values and how multiple definitions for the same property should be ordered.","$ref":"../../formattingObjectDefinitions/1.5.0/schema.json#/definitions/Selector"},"properties":{"$ref":"#/definitions/DisplayArea","description":"Describes the properties of the object to apply formatting changes to."}},"additionalProperties":false,"required":["properties"]}},"outspace":{"type":"array","items":{"type":"object","properties":{"selector":{"description":"Defines the scope at which to apply the formatting for this object.\nCan also define rules for matching highlighted values and how multiple definitions for the same property should be ordered.","$ref":"../../formattingObjectDefinitions/1.5.0/schema.json#/definitions/Selector"},"properties":{"$ref":"#/definitions/Background","description":"Describes the properties of the object to apply formatting changes to."}},"additionalProperties":false,"required":["properties"]}},"outspacePane":{"type":"array","items":{"type":"object","properties":{"selector":{"description":"Defines the scope at which to apply the formatting for this object.\nCan also define rules for matching highlighted values and how multiple definitions for the same property should be ordered.","$ref":"../../formattingObjectDefinitions/1.5.0/schema.json#/definitions/Selector"},"properties":{"$ref":"#/definitions/OutspacePane","description":"Describes the properties of the object to apply formatting changes to."}},"additionalProperties":false,"required":["properties"]}},"filterCard":{"type":"array","items":{"type":"object","properties":{"selector":{"description":"Defines the scope at which to apply the formatting for this object.\nCan also define rules for matching highlighted values and how multiple definitions for the same property should be ordered.","$ref":"../../formattingObjectDefinitions/1.5.0/schema.json#/definitions/Selector"},"properties":{"$ref":"#/definitions/FilterCard","description":"Describes the properties of the object to apply formatting changes to."}},"additionalProperties":false,"required":["properties"]}},"pageRefresh":{"type":"array","items":{"type":"object","properties":{"selector":{"description":"Defines the scope at which to apply the formatting for this object.\nCan also define rules for matching highlighted values and how multiple definitions for the same property should be ordered.","$ref":"../../formattingObjectDefinitions/1.5.0/schema.json#/definitions/Selector"},"properties":{"$ref":"#/definitions/PageRefresh","description":"Describes the properties of the object to apply formatting changes to."}},"additionalProperties":false,"required":["properties"]}},"personalizeVisual":{"type":"array","items":{"type":"object","properties":{"selector":{"description":"Defines the scope at which to apply the formatting for this object.\nCan also define rules for matching highlighted values and how multiple definitions for the same property should be ordered.","$ref":"../../formattingObjectDefinitions/1.5.0/schema.json#/definitions/Selector"},"properties":{"$ref":"#/definitions/PersonalizeVisual","description":"Describes the properties of the object to apply formatting changes to."}},"additionalProperties":false,"required":["properties"]}}},"additionalProperties":false},"PageInformation":{"type":"object","properties":{"pageInformationName":{},"pageInformationQnaPodEnabled":{},"pageInformationAltName":{},"pageInformationType":{}},"additionalProperties":false},"PageSize":{"type":"object","properties":{"pageSizeTypes":{},"pageSizeWidth":{},"pageSizeHeight":{}},"additionalProperties":false},"Background":{"type":"object","properties":{"color":{},"image":{},"transparency":{}},"additionalProperties":false},"DisplayArea":{"type":"object","properties":{"verticalAlignment":{}},"additionalProperties":false},"OutspacePane":{"type":"object","properties":{"backgroundColor":{},"transparency":{},"foregroundColor":{},"titleSize":{},"searchTextSize":{},"headerSize":{},"fontFamily":{},"border":{},"borderColor":{},"checkboxAndApplyColor":{},"inputBoxColor":{},"width":{}},"additionalProperties":false},"FilterCard":{"type":"object","properties":{"backgroundColor":{},"transparency":{},"border":{},"borderColor":{},"foregroundColor":{},"textSize":{},"fontFamily":{},"inputBoxColor":{}},"additionalProperties":false},"PageRefresh":{"type":"object","properties":{"show":{},"refreshType":{},"duration":{},"dialogLauncher":{},"measure":{},"checkEvery":{}},"additionalProperties":false},"PersonalizeVisual":{"type":"object","properties":{"show":{},"perspectiveRef":{},"applyToAllPages":{}},"additionalProperties":false},"VisualInteraction":{"type":"object","properties":{"source":{"description":"Visual name that will be the source of user interaction (selecting data point for example).","type":"string"},"target":{"description":"Visual name for the target of the interaction (selecting data point for example).","type":"string"},"type":{"$ref":"#/definitions/VisualInteractionFilterType","description":"How should the interaction flow from source to target visual (as highlights, as filter, none)."}},"additionalProperties":false,"required":["source","target","type"]},"VisualInteractionFilterType":{"type":"string","anyOf":[{"const":"Default","description":"The target visual type determines if it should accept the interaction as a highlight or as a filter."},{"const":"DataFilter","description":"Data point selection is added as a filter to the target visual."},{"const":"HighlightFilter","description":"Data point selection is added as a highlight to the target visual."},{"const":"NoFilter","description":"Data point selection is ignored by the target visual."}]},"AutoPageGenerationConfig":{"type":"object","properties":{"selectedFields":{"description":"Data fields to use for the auto page generation","type":"array","items":{"$ref":"../../semanticQuery/1.4.0/schema.json#/definitions/QueryExpressionContainer"}},"visualContainerConfigurations":{"description":"Visuals already on the page previously generated by the auto-config","type":"array","items":{"$ref":"#/definitions/QuickExploreVisualContainerConfig"}},"layout":{"description":"The specific layout chosen to render the auto-visuals","$ref":"#/definitions/QuickExploreLayoutContainer"}},"additionalProperties":false,"required":["selectedFields","visualContainerConfigurations"]},"QuickExploreVisualContainerConfig":{"type":"object","properties":{"name":{"description":"Name of the visual - matches the name property in visual.json files","type":"string"},"fields":{"description":"Specific data fields used to build this visual from the full set of selected fields","type":"array","items":{"$ref":"../../semanticQuery/1.4.0/schema.json#/definitions/QueryExpressionContainer"}}},"additionalProperties":false,"required":["fields","name"]},"QuickExploreLayoutContainer":{"type":"object","properties":{"related":{"description":"A layout that has 1 hero visual and some related visuals","$ref":"#/definitions/QuickExploreRelatedLayout"},"combination":{"description":"Layout that generates visuals purely based on combination of fields\nDeprecated: Use related layout instead.","$ref":"#/definitions/QuickExploreCombinationLayout"}},"additionalProperties":false},"QuickExploreRelatedLayout":{"type":"object","properties":{"version":{"default":1,"type":"number"},"dataTableName":{"description":"If data table is shown, then the name of that visual","type":"string"}},"additionalProperties":false,"required":["version"]},"QuickExploreCombinationLayout":{"type":"object","properties":{"version":{"default":1,"type":"number"},"dataTableName":{"description":"If data table is shown, then the name of that visual","type":"string"}},"additionalProperties":false,"required":["version"]},"Annotation":{"type":"object","properties":{"name":{"description":"Unique name for the annotation.","type":"string"},"value":{"description":"A value for this annotation.","type":"string"}},"additionalProperties":false,"required":["name","value"]}}}