{
  "$schema": "https://developer.microsoft.com/json-schemas/fabric/item/report/definition/page/2.1.0/schema.json",
  "name": "scenarios",
  "displayName": "09  GC what-if",
  "displayOption": "FitToPage",
  "height": 900,
  "width": 1440,
  "objects": {
    "background": [
      {
        "properties": {
          "color": {
            "solid": {
              "color": {
                "expr": {
                  "Literal": {
                    "Value": "'#F2F5F7'"
                  }
                }
              }
            }
          }
        }
      }
    ]
  }
}